Tweet Id,Text,Username,Coordinates,Place,processed_text,sentiment_score,sentiment_label
1229807262706753537,"Severe lockdown--#CCP paranoia or the #coronavirus has become airborne..in a big way.
#coronavirus
#ChinaCoronaVirus
#Corona
#china
#WuhanCoronavirus
#coronaviruschina
#WuhanOutbreak 
#WuhanPneumonia 
#Wuhan #CoronaVirusOutbreak #CCP #ncov2020 #CoronaVirusFacts #COVID19",josephthavaraja,,,sever lockdown ccp paranoia coronaviru becom airborn big way coronaviru chinacoronaviru corona china wuhancoronaviru coronaviruschina wuhanoutbreak wuhanpneumonia wuhan coronavirusoutbreak ccp ncov2020 coronavirusfact covid19,-0.25,negative
1229806301087195139,“....in some parts of Wuhan the lockdown has become so strict that people aren't allowed to come outside at all.” #COVID19 #Wuhan #Coronavirus,skylark1984,,,part wuhan lockdown becom strict peopl allow come outsid covid19 wuhan coronaviru,0.2263,positive
1229805349059923973,"Live Updates: Over 150 Million Chinese Are Under Coronavirus Lockdown - 750 Million Chinese Movements Are Restricted #COVID19 #COVIDー19
#coronavirus #pandemic #prepper #preppers #PrepperTalk 
https://t.co/g0IDhBMGtB",CovertPrep,,,live updat over 150 million chines are under coronaviru lockdown 750 million chines movement are restrict covid19 covidー19 coronaviru pandem prepper prepper preppertalk http co g0idhbmgtb,-0.3818,negative
1229790445519044610,"Massive lockdown in #Wuhan: ""Footage circulated on the website of the Changjiang Daily, showing officers in protective clothing knocking on people’s doors and checking their temperatures."" #COVID19  https://t.co/dDhrA4LqA5",radhikasan,,,massiv lockdown wuhan footag circul websit changjiang daili show offic protect cloth knock peopl door check temperatur covid19 http co ddhra4lqa5,0.3818,positive
1229790313545392129,"As of Feb. 14, at least 48 cities and four provinces in China have issued official notices for lockdown policies to contain #COVID19. @GurmanBhatia visualizes the regions and number of people affected by these restrictions (via @ReutersGraphics) https://t.co/WkvxVjq4wb",ReutersPR,,,As feb 14 least 48 citi four provinc china issu offici notic lockdown polici contain covid19 gurmanbhatia visual region number peopl affect restrict via reutersgraph http co wkvxvjq4wb,-0.3182,negative
1229778046967668736,#covid19 #SARSCoV2 #2019ncov #coronavirus #Quarantine #lockdown,scorpfaery,,,covid19 sarscov2 2019ncov coronaviru quarantin lockdown,0.0,neutral
1229777847029583873,"Wang Shiwen, head of local health commission in Ezhou, a city in Central #China's Hubei, which is being under city lockdown due to #COVID19, was proposed to be removed from the position: Hubei Daily. (File Photo) https://t.co/fRCXZciATt",globaltimesnews,,,wang shiwen head local health commiss ezhou citi central china hubei citi lockdown due covid19 propos remov posit hubei daili file photo http co frcxzciatt,0.0,neutral
1229768066084397056,China is struggling to get back to work after the coronavirus lockdown https://t.co/BbfLlak2IW #ChinaPneumonia #COVID19 #CoronavirusOutbreak,amadmavworld,,,china struggl get back work coronaviru lockdown http co bbfllak2iw chinapneumonia covid19 coronavirusoutbreak,0.0,neutral
1229766400652271620,"27 days into lockdown, the city of #Wuhan has received support from around the world. #COVID19 #coronavirus https://t.co/u6NHjoWBUv",AnalyticaGlobal,,,27 day lockdown citi wuhan receiv support around world covid19 coronaviru http co u6nhjowbuv,0.4019,positive
1229765007077806080,"27 days into lockdown, the city of #Wuhan has received support from around the world. #COVID19 #coronavirus https://t.co/3KwW1UzrqK",ChinaDaily,,,27 day lockdown citi wuhan receiv support around world covid19 coronaviru http co 3kww1uzrqk,0.4019,positive
1229765007019270145,Coronavirus China: Man runs marathon inside apartment amidst lockdown. #Coronavirus #Wuhan #China #COVID #CoronavirusOutbreak #CoronavirusChina #Corona #WuhanCoronavirus #COVID19 https://t.co/hPGlqbtFHP,TPE_connect,,,coronaviru china man run marathon insid apart amidst lockdown coronaviru wuhan china covid coronavirusoutbreak coronaviruschina corona wuhancoronaviru covid19 http co hpglqbtfhp,0.0,neutral
1229762605595725825,"Over 150 Million Chinese Are Under #Coronavirus Lockdown. Half of China’s population is facing new travel restrictions.

#Wuhan #China #Hubei #CoronavirusOutbreak #COVID19 

https://t.co/sDzlDiSjk3",readingonline,,,over 150 million chines are under coronaviru lockdown half china popul face new travel restrict wuhan china hubei coronavirusoutbreak covid19 http co sdzldisjk3,-0.3818,negative
1229757453509644289,"New York Times: Over 150 Million Chinese Are Under Coronavirus Lockdown. More than 10 percent of the country’s population.
- - - - -
It sounds like they DO get to leave their homes to buy food and supplies, or is that a lie? #coronavirus #COVID19",Alyndrya,,,new york time over 150 million chines are under coronaviru lockdown more 10 percent countri popul It sound like DO get leav home buy food suppli lie coronaviru covid19,0.3612,positive
1229756699604668416,"😷😷 This is staggering 😷😷

Thanks to the quarantine &amp; lockdown, the world just avoided the potential for 6 million new cases of #COVID19. The strategy is working.

I highly recommend following @yaneerbaryam for grounded and well-educated insight &amp; analysis of the outbreak.",blackbellied,,,thi stagger thank quarantin amp lockdown world avoid potenti 6 million new case covid19 the strategi work I highli recommend follow yaneerbaryam ground well educ insight amp analysi outbreak,0.5994,positive
1229752820167036930,"#BREAKING #CoronavirusOutbreak At least 150 million people may are under lockdown in #China☣️ RT #Wuhan #WHO #COVID19 #2019nCoV #USA #CDC #BioWeapon #Military #USNavy #OvalOffice #Asia #EuropeanUnion #Germany #pandemic #Medical #HarvardHealth #life #Japan 
https://t.co/8KN0Yy1MEI",EnkiSort33,,,break coronavirusoutbreak At least 150 million peopl may lockdown china RT wuhan who covid19 2019ncov usa cdc bioweapon militari usnavi ovaloffic asia europeanunion germani pandem medic harvardhealth life japan http co 8kn0yy1mei,0.0,neutral
1229742968069816321,"#news #newspoll #NewsZERO #News1st #NEWSな2人 #NewsPicks #COVID19 #COVIDー19 #China #CoronavirusOutbreak #CoronavirusWho #CoronaViruesue #Repost #Trending #Trendingformat #BREAKING #BreakingNews 
Millions Across China Are Under Lockdown due to coronavirus

https://t.co/cAsw7Nboti",elizabethblogng,,,news newspol newszero news1st newsな2人 newspick covid19 covidー19 china coronavirusoutbreak coronaviruswho coronaviruesu repost trend trendingformat break breakingnew million across china are under lockdown due coronaviru http co casw7nboti,0.0,neutral
1229722001058783233,"Coronavirus Live Updates: Millions Across China Are Under Lockdown https://t.co/RZ2pOLjV0v
#news #China #coronavirus #COVID19 #economy #health",luisfernsuarez,,,coronaviru live updat million across china are under lockdown http co rz2poljv0v news china coronaviru covid19 economi health,0.0,neutral
1229718132438241281,coronavirus aka COVID19 ain’t a joke.china now for the last three months is at standstill.Kenyans authorities should not take this thing as a joke.KITUI  should be UNDER LOCKDOWN immediately and every site closed.QUARANTINE the victims for 14days ASAP.,kimani3677,,,coronaviru aka covid19 joke china last three month standstil kenyan author take thing joke kitui under lockdown immedi everi site close quarantin victim 14day asap,0.3182,positive
1229715279845961728,"Chinese government is now reportedly (by their own press) invading people's homes in Wuhan and destroying board games and confiscating game consoles, anything that multiple people do together. Full lockdown #Covid19 #CoronaVirus https://t.co/VpE8XlTfv8",hopeseekr,,,chines govern reportedli press invad peopl home wuhan destroy board game confisc game consol anyth multipl peopl togeth full lockdown covid19 coronaviru http co vpe8xltfv8,-0.5423,negative
1229704997740384256,760 Million On Lockdown! https://t.co/9nl25UEQ9l #COVID19 #coronavirus #coronaviruschina #coronaviruswuhan #WuhanCoronavirus #Covid19usa #COVIDー19 #COVIDｰ19 #worldhealthorganization #WuhanVirus #WuhanLockDown #wuhanmarket #ChinaEconomy #ChinaCoronaVirus #China #chinaroadblocks,CALEBHITT,,,760 million On lockdown http co 9nl25ueq9l covid19 coronaviru coronaviruschina coronaviruswuhan wuhancoronaviru covid19usa covidー19 covidｰ19 worldhealthorgan wuhanviru wuhanlockdown wuhanmarket chinaeconomi chinacoronaviru china chinaroadblock,0.0,neutral
1229704608844406785,Coronavirus China: Man runs marathon inside apartment amidst lockdown #Coronavirus #Wuhan #China #COVID #CoronavirusOutbreak #CoronavirusChina #Corona #WuhanCoronavirus #COVID19 https://t.co/hPGlqbc4jf,TPE_connect,,,coronaviru china man run marathon insid apart amidst lockdown coronaviru wuhan china covid coronavirusoutbreak coronaviruschina corona wuhancoronaviru covid19 http co hpglqbc4jf,0.0,neutral
1229697937707589632,"Já parou para pensar o que significa 780 milhões de pessoas em lockdown na #China?

Desde a total restrição ao direito de circular até às cruéis formas veladas de controle social, em curso em 02/2020, devido a #COVID19, causada pelo novo #coronavirus.

https://t.co/ETKOreJv9Y",ofelipeb,"Coordinates(longitude=-43.795449, latitude=-23.08302)","Place(id='97bcdfca1a2dca59', fullName='Rio de Janeiro, Brazil', name='Rio de Janeiro', type='city', country='Brazil', countryCode='BR')",Já parou para pensar que significa 780 milhõ de pessoa em lockdown na china desd total restrição ao direito de circular até às cruéi forma velada de control social em curso em 02 2020 devido covid19 causada pelo novo coronaviru http co etkorejv9i,0.0,neutral
1229692064369127424,"Coronavirus: American factories in China unable to staff production lines as lockdown continues #China #china #coronovirus #ChinaCoronaVirus #ChinaVirus #WuhanOutbreak #COVID19 #COVIDー19 
https://t.co/iTEmElQ87o https://t.co/EHBO848YVX",scmpeconomy,,,coronaviru american factori china unabl staff product line lockdown continu china china coronoviru chinacoronaviru chinaviru wuhanoutbreak covid19 covidー19 http co itemelq87o http co ehbo848yvx,0.0,neutral
1229686728039882753,The lockdown of millions of Chinese citizens will likely continue and may be expanded until the #COVID19 has been adequately contained. Companies with factories or with local manufacturing partners may quickly find that their supply chains have been disrupted.,JohnAEastwood,,,the lockdown million chines citizen like continu may expand covid19 adequ contain compani factori local manufactur partner may quickli find suppli chain disrupt,0.5859,positive
1229686448942698496,Senior #Wuhan doctor dies from #coronavirus as authorities start to 'round up' patients https://t.co/WvjxKtnIV0 #COVID19 #CoronavirusOutbreak #2019nCoV #PublicHealth #China #lockdown #Hubei,davi326,,,senior wuhan doctor die coronaviru author start round patient http co wvjxktniv0 covid19 coronavirusoutbreak 2019ncov publichealth china lockdown hubei,-0.5994,negative
1229675876695957505,Getting delivery during COVID-19 lockdown in China https://t.co/GgKB0ryRd8 *WATCH VIDEO* #Coronavirus #Wuhan #China #COVID19 #冠状病毒 #武汉 #生存 #コロナウイルス #武漢 #中国 #新型肺炎 #Polmonite #Cina   #коронавирус  #코로나바이러스  #कोरोनावायरस,AboveMess,,,get deliveri covid 19 lockdown china http co ggkb0ryrd8 watch video coronaviru wuhan china covid19 冠状病毒 武汉 生存 コロナウイルス 武漢 中国 新型肺炎 polmonit cina коронавирус 코로나바이러스 क र न व यरस,0.0,neutral
1229673658144026624,"#Covid19 : Health Research Body May Suggest Alternative Medicines

Doctors could be directed to prescribe other drugs for key antibiotics, vitamins

Over 50 such drugs which are likely to get exhausted in next few days amid prolonged lockdown in China.

https://t.co/gRErAvjFUe https://t.co/KhItYdxmn9",parameshwaracm,,,covid19 health research bodi may suggest altern medicin doctor could direct prescrib drug key antibiot vitamin over 50 drug like get exhaust next day amid prolong lockdown china http co greravjfu http co khitydxmn9,0.3612,positive
1229668302156419077,"How quickly will China's economy recover from the #COVID19 lockdown? Rather than political statements, look at the data. Travel data show workers are not back in place yet.  https://t.co/QgeOdiscX8 https://t.co/Wyxwjvj6MV",Jeffrey_Black,,,how quickli china economi recov covid19 lockdown rather polit statement look data travel data show worker back place yet http co qgeodiscx8 http co wyxwjvj6mv,0.0,neutral
1229666860075044865,Coronavirus China: Man runs marathon inside apartment amidst lockdown.... #Coronavirus #Wuhan #China #COVID #CoronavirusOutbreak #CoronavirusChina #WuhanCoronavirus #COVID19 https://t.co/hPGlqbtFHP,TPE_connect,,,coronaviru china man run marathon insid apart amidst lockdown coronaviru wuhan china covid coronavirusoutbreak coronaviruschina wuhancoronaviru covid19 http co hpglqbtfhp,0.0,neutral
1229659269605314561,"@Hartes_Geld @Aletheia156 So dämmt man den #COVID19 nicht ein.. Afrika ist der größte Unsicherheitsherd im Moment, da kein lockdown und kaum Testmöglichkeiten.",Moddy82,,,hartes_geld aletheia156 So dämmt man den covid19 nicht ein afrika ist der größte unsicherheitsherd im moment da kein lockdown und kaum testmöglichkeiten,0.0,neutral
1229654908145721345,"BREAKING: WUHAN IS IN COMPLETE LOCKDOWN AND PEOPLE ARE VERY NERVOUS! NO ONE ALLOWED OUT OF HOMES FOR ANY REASON, NOT EVEN FOOD. ENFORCED BY ROBOT ARMY. Effectively 9 AM China Time (5 hours ago). #COVID19 #CoronaVirus https://t.co/MN9UWCEIOn",hopeseekr,,,break wuhan IS IN complet lockdown and peopl are veri nervou NO one allow out OF home for ani reason not even food enforc BY robot armi effect 9 AM china time 5 hour ago covid19 coronaviru http co mn9uwceion,-0.2577,negative
1229649840293982211,"Incredibly blue sky in #Shanghai today.  Benefits of the lockdown for #coronavirus, empty roads and clear air #COVID19 #2019nCoV https://t.co/1BSagOchAp",jonhutch,,,incred blue sky shanghai today benefit lockdown coronaviru empti road clear air covid19 2019ncov http co 1bsagochap,0.6808,positive
1229645685546344448,"🇸🇬 Singapore lockdown on #COVID19 
https://t.co/EwFoKU8yJM",merahza,,,singapor lockdown covid19 http co ewfoku8yjm,0.0,neutral
1229634227584540672,"#Wuhan a city of 11M in a lockdown
#coronarvirus 
#COVID19",NiPoisedon,,,wuhan citi 11m lockdown coronarviru covid19,0.0,neutral
1229621561788776449,Coronavirus China: Man runs marathon inside apartment amidst lockdown... #Coronavirus #Wuhan #China #COVID #CoronavirusOutbreak #CoronavirusChina #WuhanCoronavirus #COVID19 https://t.co/hPGlqbc4jf,TPE_connect,,,coronaviru china man run marathon insid apart amidst lockdown coronaviru wuhan china covid coronavirusoutbreak coronaviruschina wuhancoronaviru covid19 http co hpglqbc4jf,0.0,neutral
1229576263238479873,Coronavirus China: Man runs marathon inside apartment amidst lockdown.. #Coronavirus #Wuhan #China #COVID #CoronavirusOutbreak #CoronavirusChina #WuhanCoronavirus #COVID19 https://t.co/hPGlqbc4jf,TPE_connect,,,coronaviru china man run marathon insid apart amidst lockdown coronaviru wuhan china covid coronavirusoutbreak coronaviruschina wuhancoronaviru covid19 http co hpglqbc4jf,0.0,neutral
1229546840070262786,"Breaking news: complete #lockdown in #Wuhan - can't go out for groceries, a walk, or to scrounge in the garbage. Hope you have enough food and water. Love, the government. #COVID19 #Coronavirus #wuhanlockdown #coronavirusoutbreak https://t.co/U77Cds08hj",practicalcanuck,,,break news complet lockdown wuhan go groceri walk scroung garbag hope enough food water love govern covid19 coronaviru wuhanlockdown coronavirusoutbreak http co u77cds08hj,0.7964,positive
1229545580260708353,"How can quarantines be made successful? By devising rigorous methodologies for the evaluation of the effectiveness of the control measures implemented to stop an outbreak.

#koronavirus  #coronavirus  #COVID2019  #COVID19 #Lockdown  #Quarantine 
https://t.co/LfXINintHX",jukka235,,,how quarantin made success By devis rigor methodolog evalu effect control measur implement stop outbreak koronaviru coronaviru covid2019 covid19 lockdown quarantin http co lfxininthx,0.3612,positive
1229542788922040320,"China tightens Lockdown in #Wuhan.  No coming out at all now. 
#coronavirus #COVID19 #COVIDー19",TicoBoard,,,china tighten lockdown wuhan No come coronaviru covid19 covidー19,-0.296,negative
1229538962362052614,"#China - #LockDown - #CoronaVirus 

#COVID19 #Shenzhen",Lars9596,,,china lockdown coronaviru covid19 shenzhen,0.0,neutral
1229537119816814592,"A THREAD by a NYT-journalist on the #LockDown of 760 million people in #China: How does it work, who does it, what are the likely consequences.

What is clear: Normal life &amp; normal trade is severely impacted! 

#CoronaVirus #COVID19 #Markets",Lars9596,,,A thread nyt journalist lockdown 760 million peopl china how work like consequ what clear normal life amp normal trade sever impact coronaviru covid19 market,0.6249,positive
1229535536458670082,"""Scavenging through the trash is also not permitted...""

Total lockdown now, in #Wuhan 

#COVID19 #Coronavirustruth #China",RainbowtearsLj,,,scaveng trash also permit total lockdown wuhan covid19 coronavirustruth china,0.0,neutral
1229530965036408833,Coronavirus China: Man runs marathon inside apartment amidst lockdown. #Coronavirus #Wuhan #China #COVID #CoronavirusOutbreak #CoronavirusChina #WuhanCoronavirus #COVID19 https://t.co/hPGlqbtFHP,TPE_connect,,,coronaviru china man run marathon insid apart amidst lockdown coronaviru wuhan china covid coronavirusoutbreak coronaviruschina wuhancoronaviru covid19 http co hpglqbtfhp,0.0,neutral
1229517509457580032,"#coronavirus #covid19 
Prepping list for home lockdown feel free to add
Water,high calories food,gas camping stove to cook if no gas or electric available, toiletries, self protection, medicine basics and prescription, masks ffp3 or backup ffp2/n95, goggles and this for 3 months",solvinsonderson,,,coronaviru covid19 prep list home lockdown feel free add water high calori food ga camp stove cook ga electr avail toiletri self protect medicin basic prescript mask ffp3 backup ffp2 n95 goggl 3 month,0.7096,positive
1229513295364837378,"Perhaps millions of people are locked in their homes, certainly they are in lockdown.
The answer to the question how many infected or dead ?
We don't know.
Even China itself admits that.
In the confusion, chaos of battle no one knows.
#coronavirus #COVID19",TigressEllie,,,perhap million peopl lock home certainli lockdown the answer question mani infect dead We know even china admit In confus chao battl one know coronaviru covid19,-0.5423,negative
1229499472666939392,"Under Lockdown and Quarantine, China’s Punk Rock Bands Are Taking the Mosh Pit Online
» https://t.co/3UusvwkO5y
With venues shuttered in the wake of the #COVID19 #CoronavirusOutbreak, #China’s #indiemusic musicians are live-streaming shows and organizing “bedroom” festivals. https://t.co/5usT5Bimby",MedicalScitech,,,under lockdown quarantin china punk rock band are take mosh pit onlin http co 3uusvwko5i with venu shutter wake covid19 coronavirusoutbreak china indiemus musician live stream show organ bedroom festiv http co 5ust5bimbi,0.0,neutral
1229499434146226176,About 58 million people in China have been forced into lockdown as residents in the heart of the coronavirus outbreak are told only one family member can leave the house once every three days. #wuhan #WuhanOutbreak #ChinaCoronaVirus #coronavirus #COVID19  https://t.co/qZlxeDdOY8,getp2mask,,,about 58 million peopl china forc lockdown resid heart coronaviru outbreak told one famili member leav hous everi three day wuhan wuhanoutbreak chinacoronaviru coronaviru covid19 http co qzlxeddoy8,0.0,neutral
1229497350344736768,@DrDenaGrayson #COVID19 escaped the #2019nC0V #Hubei province when its reported 5 million immigrant workers returned to their villages in the hrs/ days before lockdown. Then we have the R0 of 2-3 where the #coronavirus spreads exponentially by 2 persons by the original contact by plane &amp; boat,savillj013,,,drdenagrayson covid19 escap 2019nc0v hubei provinc report 5 million immigr worker return villag hr day lockdown then R0 2 3 coronaviru spread exponenti 2 person origin contact plane amp boat,0.0,neutral
1229485666137862144,Coronavirus China: Man runs marathon inside apartment amidst lockdown #Coronavirus #Wuhan #China #COVID #CoronavirusOutbreak #CoronavirusChina #WuhanCoronavirus #COVID19 https://t.co/hPGlqbc4jf,TPE_connect,,,coronaviru china man run marathon insid apart amidst lockdown coronaviru wuhan china covid coronavirusoutbreak coronaviruschina wuhancoronaviru covid19 http co hpglqbc4jf,0.0,neutral
1229483827468423168,"Those threatened by #COVID19, forced into lockdown in Chinese cities are vulnerable, frightened. They're victims. What they need now is care, protection, transparent govt plan, open information, NOT intimidation, threats, punishment, police brutality!",ReneeXiaCHRD,,,those threaten covid19 forc lockdown chines citi vulner frighten they victim what need care protect transpar govt plan open inform not intimid threat punish polic brutal,0.0392,positive
1229473339191611393,Coronavirus China: Man runs marathon inside apartment amidst lockdown #Coronavirus #Wuhan #China #COVID #CoronavirusOutbreak #CoronavirusChina #WuhanCoronavirus #COVID19 https://t.co/2ZMlw5aHgr,PigeonExpress_,,,coronaviru china man run marathon insid apart amidst lockdown coronaviru wuhan china covid coronavirusoutbreak coronaviruschina wuhancoronaviru covid19 http co 2zmlw5ahgr,0.0,neutral
1229450250529787909,These situations are not being handled well. Eight planes put on lockdown at Heathrow over coronavirus fears #coronavirus #COVID19  https://t.co/bhZxMuBejM,Yiayia_sue,,,these situat handl well eight plane put lockdown heathrow coronaviru fear coronaviru covid19 http co bhzxmubejm,-0.2732,negative
1229441441035931648,"Once we realised that the Agent had escaped and would start to spread, we swiftly put all of Wuhan into lockdown.  @reddit #COVID19 https://t.co/08PCo1eSkv I was one of those tasked to manage the fallout of the contamination. https://t.co/SZDKulTbpb https://t.co/3B46gkQ9y8",alykhansatchu,,,onc realis agent escap would start spread swiftli put wuhan lockdown reddit covid19 http co 08pco1eskv I one task manag fallout contamin http co szdkultbpb http co 3b46gkq9y8,0.0,neutral
1229440158459514886,"10% of the world's population is currently under lockdown.
#coronavirus 
#COVID19",chemingineer,,,10 world popul current lockdown coronaviru covid19,0.0,neutral
1229438469778399232,@Maratosflier @suvyboy @alykhansatchu @CristinaDragani @ChrisRCason @gianlucac1 @micheleboldrin @ilariacapua @SignorErnesto @picardonhealth @Reuters @guardian @dpa Nope but they will eventually show up in hospitals if sick as the country is not yet in lockdown. I think #COVID19 has been circulating for a while now. What is batshit crazy is the reliance on CDC  for the diagnostics. We should fast track commercial kits to get a clearer pic,ChristosArgyrop,,,maratosfli suvyboy alykhansatchu cristinadragani chrisrcason gianlucac1 micheleboldrin ilariacapua signorernesto picardonhealth reuter guardian dpa nope eventu show hospit sick countri yet lockdown I think covid19 circul what batshit crazi relianc cdc diagnost We fast track commerci kit get clearer pic,-0.5106,negative
1229435786656808960,"Drone shows Chinese city under lockdown.  Creepy.
#COVID19 #coronavirus #Leaked #WuhanCoronavirusOutbreak https://t.co/3SLe7V9U8X",S85476051,,,drone show chines citi lockdown creepi covid19 coronaviru leak wuhancoronavirusoutbreak http co 3sle7v9u8x,-0.34,negative
1229423164888952834,"@ScottGottliebMD @CDC Please address if there are any clusters of #COVID19  in the USA of Chinese National students who returned to universities in mid January just before Wuhan lockdown. The communities have the right to know. CDC must be transparent
#COVID19 
#CDC",cristo_monte,,,scottgottliebmd cdc pleas address cluster covid19 usa chines nation student return univers mid januari wuhan lockdown the commun right know cdc must transpar covid19 cdc,0.0,neutral
1229418131346612224,"A sign of the types of #crime to come! #armedrobbery stealing loo rolls???Lol... its hilarious, as it was then found by #police in a #hotel room? Room service might have noticed if not? Were they expecting to be on lockdown for that long? #coronavirus #COVID19",CllrJay,"Coordinates(longitude=0.414342, latitude=50.831641)","Place(id='7a8cafd3d53ff18d', fullName='Bexhill, England', name='Bexhill', type='city', country='United Kingdom', countryCode='GB')",A sign type crime come armedrobberi steal loo roll lol hilari found polic hotel room room servic might notic were expect lockdown long coronaviru covid19,-0.5994,negative
1229417771760381952,"Rough estimates from 🇨🇳 show that ~ half the population (780 million) are under some form of lockdown (ie. travel restrictions, quarantine, etc).  #COVID19 #CoronaVirus",lumosbio,,,rough estim show half popul 780 million form lockdown ie travel restrict quarantin etc covid19 coronaviru,-0.3818,negative
1229411397706096643,"So the ship has only tested 1,723 people. 454 confirmed cases. That is a 26.35% infected rate. Still believe chinas numbers?
Wuhan population: 11million
26.35% = 2,888,500 
Maybe that is why China went into extreme measures to lockdown all these cities
#coronavirus #COVID19",InvincibleBull,,,So ship test 1 723 peopl 454 confirm case that 26 35 infect rate still believ china number wuhan popul 11million 26 35 2 888 500 mayb china went extrem measur lockdown citi coronaviru covid19,0.0772,positive
