Tweet Id,Text,Username,Coordinates,Place,processed_text,sentiment_score,sentiment_label
1234265800363646982,"Coronavirus: Washington state nursing home placed on lockdown
#COVID19 #US
https://t.co/zmGxKrZvEB",Asitseemstome,,,coronaviru washington state nurs home place lockdown covid19 US http co zmgxkrzveb,0.0,neutral
1234256311606489089,"@amybruni @JohnDePetroshow @NewportBuzz Someone I know had to rush a child to @HasbroChildrens and I'm hearing that they put the hospital on lockdown as there have been positive COVID19 tests, but nothing has made the news.",LaGringaLoca666,,,amybruni johndepetroshow newportbuzz someon I know rush child hasbrochildren I hear put hospit lockdown posit covid19 test noth made news,0.0,neutral
1234256103090933760,"@luispedrocoelho Here's how the #coronavirus situation looks like 1 week later:

could it be that Italy's 'earlier' lockdown prevented #COVID19 to further spread? If anyone is an expert on this I'd appreciate hearing your thoughts on this.

#coronavirusitalia 
#covid19italy https://t.co/02LKAcyKkg",NccAcc,,,luispedrocoelho here coronaviru situat look like 1 week later could itali earlier lockdown prevent covid19 spread If anyon expert I appreci hear thought coronavirusitalia covid19itali http co 02lkacykkg,0.3818,positive
1234248779504726017,"Tourists staying at a Tenerife hotel that has been on lockdown after five cases of the #coronavirus were detected there are free to leave if they test negative for the virus: health authorities

#Coronavid19 #COVID19
https://t.co/zLXamrBS1P",Apex_WW,,,tourist stay tenerif hotel lockdown five case coronaviru detect free leav test neg viru health author coronavid19 covid19 http co zlxamrbs1p,0.5106,positive
1234248374720835584,"We don't have a clue.
Only thing we saw is China taking draconic measures, even welding in their own people, putting almost 750 millions in quarantaine, ordering incinerators.

We don't know what we deal with! Everyone in lockdown till further notice =  cautious! 
#COVID19",AnjaLenaerts,,,We clue onli thing saw china take dracon measur even weld peopl put almost 750 million quarantain order inciner We know deal everyon lockdown till notic cautiou covid19,0.0,neutral
1234214937347551232,"To reduce my risk of getting  #covid19 #coronavirus I'm self-isolating. There might not be a vaccine for 18 months, so I'm preparing for a potentially very long lockdown. Rather than feeling fear about it, it feels like an interesting, fun problem to solve, and I'm solving it. 👍",FitzClaridge,,,To reduc risk get covid19 coronaviru I self isol there might vaccin 18 month I prepar potenti long lockdown rather feel fear feel like interest fun problem solv I solv,0.2023,positive
1234214332092866562,"#breaking

US health secretary Alex Azar confirmed new case of coronavirus in Chicago

Rhode Island announced first known case, via Italy

Italy spreading to to World

Should already stocked up food for a period of lockdown

#CoronaVirus #COVID19

https://t.co/5XKv4qUK6n",nethead,,,break US health secretari alex azar confirm new case coronaviru chicago rhode island announc first known case via itali itali spread world should alreadi stock food period lockdown coronaviru covid19 http co 5xkv4quk6n,0.0,neutral
1234204059386699777,@alisonkatebr Normally I am 100% with you on the Brexit Brit-bashing but on #covid19 UK has done a better job than NL so far. They've tested over 11k. Our @rivm had only tested 50. Which is why we have a hospital in lockdown because they hadn't bothered to test a patient they should have done,alscriv,,,alisonkatebr normal I 100 brexit brit bash covid19 UK done better job NL far they test 11k our rivm test 50 which hospit lockdown bother test patient done,0.128,positive
1234203441569746944,#coronavirus  hits football world. Juventus In Lockdown As Three Players Test Positive For The Coronavirus https://t.co/MN4axwKY0R #coronavirus #covid19 #wuhanpneumonia https://t.co/vcmFfXR3U1,MahmudRezaKhan1,,,coronaviru hit footbal world juventu In lockdown As three player test posit for the coronaviru http co mn4axwky0r coronaviru covid19 wuhanpneumonia http co vcmffxr3u1,0.0,neutral
1234200059262181386,"Potential last supper including fresh veg before #COVID19 lockdown. Fear not followers, I’m not only having the one sausage.....I ate another two whilst dishing up. https://t.co/SGwsornSE4",2Saturn23,,,potenti last supper includ fresh veg covid19 lockdown fear follow I one sausag I ate anoth two whilst dish http co sgwsornse4,-0.2263,negative
1234193798386900994,@LeaveEUOfficial So how will this work when governments are talking about putting cities in 'lockdown' if #CoVid19 gets too bad?,helenhims,,,leaveeuoffici So work govern talk put citi lockdown covid19 get bad,-0.5423,negative
1234193439337508864,"NASA dan ESA mendeteksi penurunan drastis tingkat polusi udara nitrogen dioksit di langit China sebulan setelah lockdown. #coronavirus #COVID19  Bisa jd mudah tumbangnya org2 China oleh covid19 krn polusi udara tinggi , mengurangi daya tahan tubuh",CrushHopeless1,,,nasa dan esa mendeteksi penurunan drasti tingkat polusi udara nitrogen dioksit di langit china sebulan setelah lockdown coronaviru covid19 bisa jd mudah tumbangnya org2 china oleh covid19 krn polusi udara tinggi mengurangi daya tahan tubuh,0.0,neutral
1234192137526231046,"#coronavirus UK PM says virus will likely 'spread a bit more' after UK records largest jump in new cases, 35 #covid19 #pandemic #InfectiousDisease #travelalert #uk #Lockdown",MusafirNamah,,,coronaviru UK PM say viru like spread bit UK record largest jump new case 35 covid19 pandem infectiousdiseas travelalert uk lockdown,0.3612,positive
1234191437152997377,"#coronavirus UK government is refusing to rule out placing entire cities on lockdown if the UK experiences a widespread coronavirus outbreak, according to the health secretary.  #covid19 #pandemic #InfectiousDisease #travelalert #uk #Lockdown",MusafirNamah,,,coronaviru UK govern refus rule place entir citi lockdown UK experi widespread coronaviru outbreak accord health secretari covid19 pandem infectiousdiseas travelalert uk lockdown,0.0,neutral
1234185385930055680,"The #CoronavirusOutbreak could force the UK to implement sweeping restrictions on travel and place cities on #Lockdown, the country’s #Health secretary suggested, in the starkest admission yet on what #London might do curb the spread of the #COVID19 virus. https://t.co/2muFdCbtzV",EpochTimesChina,,,the coronavirusoutbreak could forc UK implement sweep restrict travel place citi lockdown countri health secretari suggest starkest admiss yet london might curb spread covid19 viru http co 2mufdcbtzv,-0.3818,negative
1234153688458907648,"#UK health secretary @MattHancock says to @BBCNews: govt is refusing to rule out placing entire cities on lockdown if UK experiences a widespread #coronavirus outbreak. Hope it does not happen&amp; #COVID19 gets contained. But will lockdown serve the purpose?

https://t.co/6FSdueZbWj",bobbyramakant,,,UK health secretari matthancock say bbcnew govt refus rule place entir citi lockdown UK experi widespread coronaviru outbreak hope happen amp covid19 get contain but lockdown serv purpos http co 6fsduezbwj,0.2382,positive
1234144608616976386,Wholesome family fun during #coronavirus lockdown #COVID19 https://t.co/t3g2PlD1rv,CarlZha,,,wholesom famili fun coronaviru lockdown covid19 http co t3g2pld1rv,0.5106,positive
1234142695670657025,"@actarus1070 
-cazzata n.4: riaprire dopo 1 settimana dopo pressioni di negozi e bottegai che vedono solo a un palmo dal naso. Il Lockdown deve essere minimo 15 gg se non 21, visto tempo incubazione. Serve a rallentare  contagio x evitare blocchi futuri  se TUTTI malati #COVID19",ossimorobiondo,,,actarus1070 cazzata n 4 riaprir dopo 1 settimana dopo pressioni di negozi e bottegai che vedono solo un palmo dal naso Il lockdown deve esser minimo 15 gg se non 21 visto tempo incubazion serv rallentar contagio x evitar blocchi futuri se tutti malati covid19,0.296,positive
1234142456201064450,"#COVID19
One month lockdown in #Wuhan
https://t.co/544iOQUVUP",Karl_Pichler,,,covid19 one month lockdown wuhan http co 544ioquvup,0.0,neutral
1234141870084755457,"@BreakingNovel Dutch hospital in lockdown after ignoring WHO-COVID19 guidelines.

https://t.co/o1jxyiSnUV",RDSquadra37899,,,breakingnovel dutch hospit lockdown ignor who covid19 guidelin http co o1jxyisnuv,0.0,neutral
1234141806394101760,Seems like world govts (ex China and Singapore?) are incapable or unwilling to enforce sufficiently aggressive #covid19 surveillance and social lockdown to “contain”/slow the spread of the pandemic,spencemo_c,,,seem like world govt ex china singapor incap unwil enforc suffici aggress covid19 surveil social lockdown contain slow spread pandem,0.0516,positive
1234136788035391492,BREAKING NEWS: Hospital in the Netherlands on lockdown patient was in the ICU for 1 week .. but the RIVM did not think it was necessary to test for covid-19 Now they are closing a hospital. with the patients in it #COVID19  #COVID19 https://t.co/9mkEPzPMFd,DietsjeWah,,,break new hospit netherland lockdown patient icu 1 week rivm think necessari test covid 19 now close hospit patient covid19 covid19 http co 9mkepzpmfd,0.0,neutral
1234135496084918272,@matthew_weaver Cases of #COVID19 in the Netherlands have risen from seven to ten with three newly confirmed patients. One of the patients first went to a hospital in Gorinchem which is currently on lockdown except for personnel. source: press conference RIVM,ElisevanderWiel,,,matthew_weav case covid19 netherland risen seven ten three newli confirm patient one patient first went hospit gorinchem current lockdown except personnel sourc press confer rivm,0.0,neutral
1234133602117521408,"BREAKING @BNODesk #COVID19 

- 10 Corona patients NL
- #Gorinchem Beatrix hospital on semi lockdown
- people with fever, cough or similar complaints are held within the hospital
- Patient in Gorinchem kept for about 5 days on the Intensive care before transfer to Rotterdam.",KenzoSuai,,,break bnodesk covid19 10 corona patient NL gorinchem beatrix hospit semi lockdown peopl fever cough similar complaint held within hospit patient gorinchem kept 5 day intens care transfer rotterdam,0.25,positive
1234131914212155393,"Regardless of whether you think #COVIDー19 is just another flu, it is a virus that was not in circulation. Much is still unknown and continued spread, even just mild symptoms, will become problematic. That is why countries continue lockdown responses. #CoronaVirusUpdate #COVID19",GoBillsRecap,,,regardless whether think covidー19 anoth flu viru circul much still unknown continu spread even mild symptom becom problemat that countri continu lockdown respons coronavirusupd covid19,-0.3818,negative
1234131622687100928,"“So far, I haven’t been paid for a month,” Zhang said. “It’s a burden because there is overhead, I have to pay rent, to buy necessities and to stock up [on life supplies].” 
Life inside #Wuhan #lockdown, story by @angelatys19. #CoronaVirusUpdate #COVID19 
https://t.co/5SmzuVGz5i",Gobserver_nu,,,So far I paid month zhang said It burden overhead I pay rent buy necess stock life suppli life insid wuhan lockdown stori angelatys19 coronavirusupd covid19 http co 5smzuvgz5i,-0.5106,negative
1234130670731104259,@guardian Cases of #COVID19 in the Netherlands have surged from seven to ten with three newly confirmed patients. One of the patients first went to a hospital in Gorinchem which is currently on lockdown except for personnel. source: press conference RIVM,ElisevanderWiel,,,guardian case covid19 netherland surg seven ten three newli confirm patient one patient first went hospit gorinchem current lockdown except personnel sourc press confer rivm,0.0,neutral
1234129918910455810,Travel restrictions and bans and closures of public places and spaces to begin soon across the #UK cities and towns lockdown and public places and gatherings to be restricted due to #COVID19 #covid19UK,nanakumi1976,,,travel restrict ban closur public place space begin soon across UK citi town lockdown public place gather restrict due covid19 covid19uk,-0.8316,negative
1234129560117170176,"Here it’s just announced they have an entire hospital on lockdown bc of #COVID19. 

Apparently they had a patient on the IC with coughing and lung issues but didn’t think to test her. That only happened after she was transferred to another hospital. 🙄 This country man.",vantaethings,,,here announc entir hospit lockdown bc covid19 appar patient IC cough lung issu think test that happen transfer anoth hospit thi countri man,0.0,neutral
1234129312800002053,Wow China’s air pollution dropped dramatically after coronavirus lockdown #covid19 #airpollution #co2 #smartcity #emissions  https://t.co/0Ce0lfqJQ9 https://t.co/qOlvcpHZq1,morganefitz,,,wow china air pollut drop dramat coronaviru lockdown covid19 airpollut co2 smartciti emiss http co 0ce0lfqjq9 http co qolvcphzq1,0.4019,positive
1234128552582426626,"Currently there are 10 people infected with the #Coronavirus in The Netherlands.

A hospital in #Gorinchem is currently under lockdown.

#COVID19 #CoronaVirusUpdate #Corona",TheMitchHD,,,current 10 peopl infect coronaviru the netherland A hospit gorinchem current lockdown covid19 coronavirusupd corona,0.0,neutral
1234128168241504257,4 new cases of #coronavirus in #netherlands. A hospital in Gorichem is in lockdown due to a patient in ICU. Two new cases (#couvorden and #tilburg) are related to caranval in #Tilburg. This seems an uncontrolled spread. #coronavirus #covid2019 #covid19,JaapUrsem,,,4 new case coronaviru netherland A hospit gorichem lockdown due patient icu two new case couvorden tilburg relat caranv tilburg thi seem uncontrol spread coronaviru covid2019 covid19,0.0,neutral
1234126418310766592,"Juventus In Lockdown As 3 Footballers Test Positive For The #Coronavirus
#Covid #Covid19 #Covid2019 
https://t.co/Vb1dcZ755L",TicoBoard,,,juventu In lockdown As 3 footbal test posit for the coronaviru covid covid19 covid2019 http co vb1dcz755l,0.0,neutral
1234126299846905856,"Breaking: Dutch patiënt infected with #CoronaVirus possibly spread virus in a hospital in Gorinchem. They are reviewing how many other patients and staff got infected as well while hospital is in lockdown

#coronavirusNederland
#CoronaVirusUpdate
#COVID19",koptikqueen,,,break dutch patiënt infect coronaviru possibl spread viru hospit gorinchem they review mani patient staff got infect well hospit lockdown coronavirusnederland coronavirusupd covid19,0.2732,positive
1234125732772745217,"M.A.W.: In Gorinchem was men te laks met testen, iets wat men in Rotterdam later wel deed. Door die laksheid kan nu het hele ziekenhuis in #lockdown. #corona #CoronaVirusUpdate #COVID19",robvanraay,,,M A W In gorinchem men te lak met testen iet wat men rotterdam later wel deed door die laksheid kan nu het hele ziekenhui lockdown corona coronavirusupd covid19,-0.5994,negative
1234124885879873537,"@rivm @lookner Beatrix Hospital in Gorinchem, Netherlands in lockdown due to #COVID19",mastermattie,,,rivm lookner beatrix hospit gorinchem netherland lockdown due covid19,0.0,neutral
1234119433066622976,"BREAKING - Juventus in lockdown as THREE players test positive for #COVID19. All training sessions halted, after a trio of players from recent opponents Pianese tested positive for the novel coronavirus. https://t.co/vpTLgbgGqi",WorldNow9,,,break juventu lockdown three player test posit covid19 all train session halt trio player recent oppon pianes test posit novel coronaviru http co vptlgbggqi,0.3182,positive
1234119235217084416,"Football
RT Sport
@RTSportNews
BREAKING: Juventus in lockdown as THREE players test positive for coronavirus
#COVID19 #Coronavirus #Juve https://t.co/OWxtS2NfkH",kardepravin,,,footbal RT sport rtsportnew break juventu lockdown three player test posit coronaviru covid19 coronaviru juve http co owxts2nfkh,0.0,neutral
1234116320024760320,"@YourDadSideChic BREAKING: Juventus in lockdown as THREE players test positive for coronavirus

#COVID19 #Coronavirus #Juve https://t.co/WlrvU193Kb",Boskadee,,,yourdadsidech break juventu lockdown three player test posit coronaviru covid19 coronaviru juve http co wlrvu193kb,0.0,neutral
1234116181432393728,"#Covid19
.. Moreover, once the choice has been made to let the epidemic run its course, it cannot be reversed. Although the subsequent lockdown has been far more severe than in the rest of China, the vast majority of new cases in the country continue to be centered in Hubei. 1/",ABetterYouToda1,,,covid19 moreov choic made let epidem run cours cannot revers although subsequ lockdown far sever rest china vast major new case countri continu center hubei 1,0.0,neutral
1234114608442507264,"@TheViralTrendz BREAKING: Juventus in lockdown as THREE players test positive for coronavirus

#COVID19 #Coronavirus #Juve https://t.co/WlrvU193Kb",Boskadee,,,theviraltrendz break juventu lockdown three player test posit coronaviru covid19 coronaviru juve http co wlrvu193kb,0.0,neutral
1234114404804911104,"@MrOdanz @BHADAMAN_ BREAKING: Juventus in lockdown as THREE players test positive for coronavirus

#COVID19 #Coronavirus #Juve https://t.co/WlrvU193Kb",Boskadee,,,mrodanz bhadaman_ break juventu lockdown three player test posit coronaviru covid19 coronaviru juve http co wlrvu193kb,0.0,neutral
1234111047876960262,"#BREAKING: #Juventus in lockdown as THREE players test positive for coronaviru. #USA #London #France #UK #WuhanCoronavirus 
#COVID19 #Coronavirus #Juve #CoronaVirusUpdate #Coronavid19 #CoronavirusFrance @RTSportNews",ImadSalamoun,,,break juventu lockdown three player test posit coronaviru usa london franc UK wuhancoronaviru covid19 coronaviru juve coronavirusupd coronavid19 coronavirusfr rtsportnew,0.0,neutral
1234109691329941504,"RT Sport en Twitter: ""BREAKING: Juventus in lockdown as THREE players test positive for coronavirus Tres jugadores del Juventus positivo para #COVID19 #Coronavirus #Juve https://t.co/sLg4MyfEPe"" / Twitter https://t.co/2gussjumFF",ANDRO1711,,,RT sport en twitter break juventu lockdown three player test posit coronaviru tre jugador del juventu positivo para covid19 coronaviru juve http co slg4myfep twitter http co 2gussjumff,0.0,neutral
1234109360747556864,"🌐 World Newz 🌐 Juventus in lockdown as THREE players test positive for coronavirus

#COVID19 #Coronavirus #Juve - RT https://t.co/RmCP5qkizk",BreakinNewz01,,,world newz juventu lockdown three player test posit coronaviru covid19 coronaviru juve RT http co rmcp5qkizk,0.0,neutral
1234106825500323843,"Latest for @Independent - Amid the #COVID19 outbreak in #China, I explored how the enforced lockdown across #Hubei province has impacted the lives of other patients living with chronic disease like HIV and how a nonprofit group tried to ... https://t.co/ESDYkWSxsC",WilliamYang120,,,latest independ amid covid19 outbreak china I explor enforc lockdown across hubei provinc impact live patient live chronic diseas like hiv nonprofit group tri http co esdykwsxsc,0.3612,positive
1234104088817754113,"Matt Hancock, Secretário da Saúde do Reino Unido, já deixou claro: Inglaterra vai adotar o modelo chinês de lockdown para combater a #COVID19. 

Para tratar os pacientes infectados por #SARSCoV2 está recrutando e treinando médicos aposentados.

Esforço de guerra.

E aqui? Beleza?",ofelipeb,"Coordinates(longitude=-43.795449, latitude=-23.08302)","Place(id='97bcdfca1a2dca59', fullName='Rio de Janeiro, Brazil', name='Rio de Janeiro', type='city', country='Brazil', countryCode='BR')",matt hancock secretário da saúd reino unido já deixou claro inglaterra vai adotar modelo chinê de lockdown para combat covid19 para tratar os pacient infectado por sarscov2 está recrutando e treinando médico aposentado esforço de guerra E aqui beleza,-0.34,negative
1234102747307368448,BREAKING: Juventus In Lockdown As Three Players Test Positive For The Coronavirus via @forbes https://t.co/diR4Uoj3ZU #COVID19 #BREAKING #coronavirus,SurviveCOVID19,,,break juventu In lockdown As three player test posit for the coronaviru via forb http co dir4uoj3zu covid19 break coronaviru,0.0,neutral
1234100286496681986,"⚠️Tourists at the four-star H10 Costa Adeje Palace resort in Tenerife, Spain, are on lockdown for  two weeks after doctor visiting from Italy tested positive #COVID19
Hundreds of tourists sealed off #coronavirus #CoronaOutbreak
#COVID #Coronavid19
🧐 https://t.co/89UUcfGr1z",ASanswers,,,tourist four star h10 costa adej palac resort tenerif spain lockdown two week doctor visit itali test posit covid19 hundr tourist seal coronaviru coronaoutbreak covid coronavid19 http co 89uucfgr1z,0.0,neutral
1234087373488689153,"[Recap] ‘No one cares’: Wuhan residents adapt to find food during coronavirus lockdown

https://t.co/EyADnL8zdl #wuhan #China #coronavirus #ChinaCoronaVirus #CoronavirusOutbreak #Covid19 https://t.co/e7N8JPBxhX",hkfp,,,recap No one care wuhan resid adapt find food coronaviru lockdown http co eyadnl8zdl wuhan china coronaviru chinacoronaviru coronavirusoutbreak covid19 http co e7n8jpbxhx,0.25,positive
1234080576275124229,"@nowthisnews Yeah, we got ten cases of water. Can food for a month and medical and cleaning supplies for 2 months,
   In case of a mayor Lockdown.
All cities and communities quarantined.
Imagine staying in your Home for 2 months, until after April 30th.

Good luck!

#COVID19 #Coronavid19",MASTERJOEYJEDI,,,nowthisnew yeah got ten case water can food month medic clean suppli 2 month In case mayor lockdown all citi commun quarantin imagin stay home 2 month april 30th good luck covid19 coronavid19,0.8689,positive
1234075830944444416,"Coronavirus outbreak could force UK to shut down entire cities.
#COVID19 #COVIDー19 #COVID 
The government is refusing to rule out placing entire cities on lockdown if the UK experiences a widespread outbreak of the novel coronavirus, according to the health secretary. https://t.co/VP11MbGzE1",allcarx2,,,coronaviru outbreak could forc UK shut entir citi covid19 covidー19 covid the govern refus rule place entir citi lockdown UK experi widespread outbreak novel coronaviru accord health secretari http co vp11mbgze1,0.3182,positive
1234068808480043008,"Video from Italy helps manage expectations for #COVID19 #lockdown. Today TV driven society is fixated on sex but cannot talk about death (opposite of Victorian society that fixated on death that could not talk of sex) Will #Covid #pandemic change this?
 https://t.co/yEHP1yFCBT",alexanderwatso,,,video itali help manag expect covid19 lockdown today TV driven societi fixat sex cannot talk death opposit victorian societi fixat death could talk sex will covid pandem chang http co yehp1yfcbt,0.8398,positive
1234065981808398336,"#COVID19 Update, March 1:
- Iran: 43 dead, partial lockdown of Qom region
- USA: 1st death; state of emergency declared in Washington state
- Ireland, Qatar, Luxembourg, Armenia report 1st case 
- WHO: global risk raised to 'very high' https://t.co/OsoF99Ju7o",GlobalTimesBiz,,,covid19 updat march 1 iran 43 dead partial lockdown qom region usa 1st death state emerg declar washington state ireland qatar luxembourg armenia report 1st case who global risk rais high http co osof99ju7o,-0.8834,negative
1234063179187019776,"@ChrisEgginton @abcnews I'm trying to think of how this virus will impact on the community. The Flu has vaccines for the elderly to reduce the impact if they do come in contact with it, but not covid19. Can you imagine this going through aged care? 80 cases of norovirus despite lockdown in my Mum's..",JenHogben,,,chrisegginton abcnew I tri think viru impact commun the flu vaccin elderli reduc impact come contact covid19 can imagin go age care 80 case noroviru despit lockdown mum,0.1531,positive
1234054523741585418,"#COVID19 Update, March 1:
- Iran: 43 dead, partial lockdown of Qom region
- USA: 1st death; state of emergency declared in Washington state
- Ireland, Qatar, Luxembourg, Armenia report 1st case 
- WHO: global risk raised to 'very high' https://t.co/CdsFUK1fdS",globaltimesnews,,,covid19 updat march 1 iran 43 dead partial lockdown qom region usa 1st death state emerg declar washington state ireland qatar luxembourg armenia report 1st case who global risk rais high http co cdsfuk1fd,-0.8834,negative
1234037011096297472,"Does the existing legal system allow #Japan to place towns under lockdown, curtail public transport and cancel private-sector events? #COVID19
 https://t.co/n8VB5cKAdY",TomohiroOsaki,,,doe exist legal system allow japan place town lockdown curtail public transport cancel privat sector event covid19 http co n8vb5ckadi,0.1027,positive
1234023436730548224,"#Coronavirus (#COVID19) lockdown in #China has air #pollution levels tumbling, #NASA #satellites reveal:

https://t.co/pFbDlXG9mk

https://t.co/ZnVovbTj2M https://t.co/QxL9E6OQ2S",benjohn65,,,coronaviru covid19 lockdown china air pollut level tumbl nasa satellit reveal http co pfbdlxg9mk http co znvovbtj2m http co qxl9e6oq2,0.0,neutral
1233984558313304064,"@AngryBlackLady It’s all Covid19 over here. Someone died nearby and there’s an assisted living facility on lockdown because the whole damn place is infected. 

Livin’ in wild times for sure.",JustABitAlien,,,angryblackladi It covid19 someon die nearbi assist live facil lockdown whole damn place infect livin wild time sure,-0.6486,negative
1233980246472282112,"Sky News - Footage has emerged of a hotel in Tenerife in lockdown after an Italian guest tested positive for #COVID19, the disease caused by #uncategorized https://t.co/YGkYZvOQQ8",chovy,,,ski new footag emerg hotel tenerif lockdown italian guest test posit covid19 diseas caus uncategor http co ygkyzvoqq8,0.0,neutral
